id,text_raw,reposts_count,comments_count,attitudes_count,region_name,created_at,articleUrl,authorId,authorName,authorHomeUrl
5300039979371283,大学要不要不预约的开放需要大学自身根据自身情况和承载量来判断其实现在多数大学简单预约一下就可以进入江浙沪这边预约主要是为了停车不然真的不好管理我曾经在好几个大学目睹学生吃饭排队的场景有些高校没有不预约开放依旧要采取限流措施错峰让学生吃饭这种情况下用舆论倒逼大学开放并不合适把大学开放的权力交给高校让他们根据自身的状况来决定这才是科学的大学是否要不预约无限开放与胡锡进说的开放包容自由和培育有担当的知识分子没有任何关系这些都是老登思维的自我脑补用舆论道德绑架高校以博取他自己那点名声高校只要根据自身实际情况合理规划就行当然多数情况是没必要封闭的但也要考虑自身硬件承载量和学生的需求不要为了开放而开放毕竟跟风出了事胡锡进除了跑出来批评你们几句他不会承认任何责任我个人认为做好预约登记的开放挺好暑假寒假可以敞开大门让市民自由游玩学习期间还是做点人流管控这些都需要高校科学安排,3,5,18,浙江,2026-05-18 21:37:44,https://weibo.com/1895859130/R012tDjTJ,1895859130,徐记观察,https://weibo.com/u/1895859130
5300052425968717,不道中南大学爱不爱看反正我是很爱看这种不同平台的评论区氛围对比哪怕是相同的一句长得像吴亦凡说出来也是三种花样,3,2,5,中国香港,2026-05-18 22:27:11,https://weibo.com/3047303430/R01myp2JD,3047303430,萤风抛壳,https://weibo.com/u/3047303430
5300051272273260,设想一下如果要写完整故事的话以今天那篇出租屋短打为例子我要盘好时间线起码要个大致的起承转合想好初遇时lz具体几岁想好zzw的出租屋是什么格局搬到大一点都房子之后又是什么格局要想zzw在打什么工会做什么兼职以后日子慢慢好起来的话是因为什么契机要想他俩关系的转折点心意的转变还要想lz读大学的地方要想好多好多哦写完整故事果然很难啊写文老师们辛苦[柯基][柯基][柯基],0,5,5,浙江,2026-05-18 22:22:36,https://weibo.com/7025657431/R01kH9xnu,7025657431,随便来点自助餐,https://weibo.com/u/7025657431
5300048742324654,南京大学博士的观点[并不简单]姚晨方回应曝监狱来的妈妈撤档电影监狱来的妈妈,2,0,12,山东,2026-05-18 22:12:33,https://weibo.com/3551109611/R01gC9KKq,3551109611,旅行厨男,https://weibo.com/u/3551109611
5300048477036873,VIDEOLIVEBIBI2026朝鲜大学校庆TRACKLIST00000045TheWeekendwith88risng03430500with072209121228140217361906221025432800284630113321crCUEBHIGUYSbibi[超话],1,0,11,马来西亚,2026-05-18 22:11:30,https://weibo.com/5528437256/R01gbtwBX,5528437256,HIGUYS_official,https://weibo.com/u/5528437256
